{
  "$schema": "https://json-schema.org/draft/2020-12/schema",
  "title": "Light",
  "description": "A light source.",
  "type": "array",
  "items": {
    "additionalProperties": false,
    "properties": {
      "name": {
        "description": "Name of the light source.",
        "type": "string",
        "default": "Name"
      },
      "color": {
        "description": "Color of the light source.",
        "type": "array",
        "items": {
          "type": "number"
        },
        "default": [1, 1, 1],
        "minItems": 3,
        "maxItems": 3
      },
      "temperature": {
        "description": "Color temperature in Kelvin, if color lies on the Planckian curve.",
        "type": "number",
        "default": 6500
      },
      "temperatureRange": {
        "description": "The typical range of color temperature for this specific light source.",
        "type": "array",
        "items": {
          "type": "number"
        },
        "default": [6500, 7000],
        "minItems": 2,
        "maxItems": 2
      },
      "intensity": {
        "type": "number",
        "default": 0
      },
      "intensityRange": {
        "description": "The typical range of intensity for this specific light source.",
        "type": "array",
        "items": {
          "type": "number"
        },
        "default": [0, 1],
        "minItems": 2,
        "maxItems": 2
      },
      "unit": {
        "type": "array",
        "items": {
          "enum": ["lm", "lx", "cd/m2"]
        },
        "minItems": 1,
        "maxItems": 1
      },
      "angle": {
        "description": "The maximum beam angle in degrees. For a directional light, this specifies angular diameter instead.",
        "type": "number",
        "default": 90
      },
      "sourceSize": {
        "description": "The size of the light source in centimeters. [Radius] if point or spot. [Width, Height] if surface. [Length, Radius] if cylinder.",
        "type": "array",
        "items": {
          "type": "number"
        },
        "minItems": 1,
        "maxItems": 2
      },
      "type": {
        "description": "The type of light, for DCC applications.",
        "type": "array",
        "items": {
          "enum": [
            "directional",
            "surface",
            "spot",
            "point",
            "cylinder",
            "dome"
          ]
        },
        "minItems": 1,
        "maxItems": 1
      },
      "variants": {
        "description": "If the light source comes in different variations, they can be described here.",
        "type": "array",
        "minItems": 1,
        "items": {
          "additionalProperties": false,
          "type": "object",
          "properties": {
            "format": {
              "description": "Specifies the format.",
              "type": "string",
              "default": "Default"
            },
            "color": {
              "description": "Color of the light source.",
              "type": "array",
              "items": {
                "type": "number"
              },
              "default": [1, 1, 1],
              "minItems": 3,
              "maxItems": 3
            },
            "temperature": {
              "description": "Color temperature in Kelvin, if color lies on the Planckian curve.",
              "type": "number",
              "default": 6500
            },
            "intensity": {
              "description": "Intensity of the light emitted from the light source.",
              "type": "number",
              "default": 0
            },
            "angle": {
              "description": "The maximum beam angle in degrees. For a directional light, this specifies angular diameter instead.",
              "type": "number",
              "default": 90
            },
            "sourceSize": {
              "description": "The size of the light source in centimeters. [Radius] if point or spot. [Width, Height] if surface. [Length, Radius] if cylinder.",
              "type": "array",
              "items": {
                "type": "number"
              },
              "minItems": 1,
              "maxItems": 2
            }
          }
        },
        "required": ["format", "color", "intensity"]
      },
      "category": {
        "type": "array",
        "items": {
          "enum": ["Artificial", "Natural"]
        },
        "minItems": 1,
        "maxItems": 1
      },
      "description": {
        "description": "This field should be used for disclaimers and other useful info for CG artists that may affect the way they use the values. It's totally fine to leave this empty.",
        "type": "string",
        "maxLength": 500
      },
      "sources": {
        "description": "Provide at least one source for the values.",
        "type": "array",
        "items": {
          "type": "string",
          "minLength": 1
        },
        "minItems": 1,
        "uniqueItems": true
      },
      "tags": {
        "description": "Tags",
        "type": "array",
        "items": {
          "type": "string"
        },
        "uniqueItems": true
      }
    },
    "anyOf": [
      {
        "required": ["color", "intensity"]
      },
      {
        "required": ["variants"]
      }
    ],
    "required": [
      "name",
      "color",
      "intensity",
      "unit",
      "category",
      "description",
      "sources"
    ]
  }
}
